{
  "$schema": "https://wargamedata.com/aos4/schema/terrain.schema.json",
  "id": "terrain.seraphon.realmshaper_engine",
  "bsdataId": "dbb9-da98-e92e-b31e",
  "type": "terrain",
  "name": "Realmshaper Engine",
  "faction": "seraphon",
  "keywords": [
    "faction terrain",
    "order",
    "faction:seraphon"
  ],
  "stats": {
    "move": "-",
    "health": 15,
    "save": "4+",
    "control": "-"
  },
  "abilities": [
    {
      "name": "Fierce Guardians",
      "type": "passive",
      "effect": "Add 1 to hit rolls for combat attacks made by friendly **^^Saurus^^** or **^^Kroxigor^^** units that target an enemy unit while that enemy unit is within 9\" of this terrain feature.",
      "color": "Red",
      "abilityCategory": "Offensive"
    },
    {
      "name": "Power Unleashed",
      "type": "once-per-turn",
      "effect": "Roll a D3 for each target. On a 2+, inflict an amount of mortal damage on the target equal to the roll. If that terrain feature has a Health characteristic, inflict D3 mortal damage on it.",
      "phase": "hero",
      "declare": "If there are any friendly **^^Seraphon Wizards^^** within 3\" of this terrain feature, pick another terrain feature within 24\" of this terrain feature, then pick up to 3 enemy units within 3\" of that terrain feature to be the targets.",
      "color": "Yellow",
      "abilityCategory": "Offensive"
    }
  ],
  "_meta": {
    "lastUpdated": "2026-01-09",
    "source": "BSData import"
  },
  "grandAlliance": "order"
}
